<?xml version='1.0'?>
<bookdata xmlns:xsi="http://www.w3.org/2001/XMLSchema-instance" xsi:noNamespaceSchemaLocation="books.xsd">
    <book>
        <author_info>
            <author_name>
                <Firstname>Chirag</Firstname>
				<Middlename>B</Middlename>
                <Lastname>Chudasama</Lastname>
            </author_name>
            <date_of_birth>1992-03-06</date_of_birth>
            <highedu>MS</highedu>
            <address>
                <StreetnameAuthor>7815 McCallum</StreetnameAuthor>
                <Aptnum>6202</Aptnum>
                <CityAuthor>Dallas</CityAuthor>
                <zipcodeAuthor>75252</zipcodeAuthor>
                <CountryAuthor>USA</CountryAuthor>
            </address>
            <Pbookno>3</Pbookno>
        </author_info>
		<Pub_info>
                <pub_name>The Bookhouse</pub_name>
                <pub_address>
                    <Streetname>1818 Vepari road</Streetname>
                    <suite_no>26</suite_no>
                    <City>Chennai</City>
                    <zipcode>50001</zipcode>
                    <Country>India</Country>
                </pub_address>
                <C_time>06-04-11</C_time>
            </Pub_info>
        <bookinfo>
            <Title>The Secret</Title>
            <ISBN>976-973-4473</ISBN>
            <price currency="dollars">124.00</price>
            <Pub_date>2008-06-19</Pub_date>
        </bookinfo>
    </book>
    <book>
        <author_info>
            <author_name>
                <Firstname>Kaushik</Firstname>
                <Lastname>Desai</Lastname>
            </author_name>
            <date_of_birth>1992-07-28</date_of_birth>
            <highedu>PHD</highedu>
            <address>
                <StreetnameAuthor>202 GreenView</StreetnameAuthor>
                <CityAuthor>Mumbai</CityAuthor>
                <zipcodeAuthor>400059</zipcodeAuthor>
                <CountryAuthor>India</CountryAuthor>
            </address>
            <Pbookno>1</Pbookno>
        </author_info>
        <bookinfo>
            <Title>Harry Potter</Title>
            <ISBN>469-422-4218</ISBN>
            <price currency="dollars">65.00</price>
            <Pub_date>2013-02-28</Pub_date>
            <Pub_info>
                <pub_name>Techmax Publications</pub_name>
                <pub_address>
                    <Streetname>52 Varacha road</Streetname>
                    <suite_no>420</suite_no>
                    <City>Surat</City>
                    <zipcode>700015</zipcode>
                    <Country>India</Country>
                </pub_address>
                <C_time>02-10-01</C_time>
            </Pub_info>
        </bookinfo>
    </book>
    <book>
        <author_info>
            <author_name>
                <Firstname>Sanket</Firstname>
                <Lastname>Prabhu</Lastname>
            </author_name>
            <date_of_birth>1988-05-10</date_of_birth>
            <highedu>MBA</highedu>
            <address>
                <StreetnameAuthor>215 Dickson st</StreetnameAuthor>
                <CityAuthor>London</CityAuthor>
                <zipcodeAuthor>85080</zipcodeAuthor>
                <CountryAuthor>UK</CountryAuthor>
            </address>
            <Pbookno>5</Pbookno>
        </author_info>
        <bookinfo>
            <Title>Human Computer Interaction</Title>
            <ISBN>808-024-2854</ISBN>
            <price currency="dollars">93.00</price>
            <Pub_date>2005-10-21</Pub_date>
            <Pub_info>
                <pub_name>Square Space</pub_name>
                <pub_address>
                    <Streetname>77th Brooklyn ave</Streetname>
                    <suite_no>22</suite_no>
                    <City>New York</City>
                    <zipcode>72015</zipcode>
                    <Country>USA</Country>
                </pub_address>
                <C_time>09-02-09</C_time>
            </Pub_info>
        </bookinfo>
    </book>
	
	
	
	<book>
        <author_info>
            <author_name>
                <Firstname>Arjun</Firstname>
                <Lastname>Gohil</Lastname>
            </author_name>
            <date_of_birth>1982-09-15</date_of_birth>
            <highedu>BS</highedu>
            <address>
                <StreetnameAuthor>2525 Anand Nagar</StreetnameAuthor>
                <Aptnum>2</Aptnum>
                <CityAuthor>Mumbai</CityAuthor>
                <zipcodeAuthor>400068</zipcodeAuthor>
                <CountryAuthor>India</CountryAuthor>
            </address>
            <Pbookno>9</Pbookno>
        </author_info>
        <bookinfo>
            <Title>Awesome Accounting!</Title>
            <ISBN>989-620-2569</ISBN>
            <price currency="dollars">66.00</price>
            <Pub_date>2000-05-25</Pub_date>
            <Pub_info>
                <pub_name>Lynda Inc</pub_name>
                <pub_address>
                    <Streetname>798 Coit rd</Streetname>
                    <suite_no>65</suite_no>
                    <City>Dallas</City>
                    <zipcode>70581</zipcode>
                    <Country>USA</Country>
                </pub_address>
                <C_time>14-05-06</C_time>
            </Pub_info>
        </bookinfo>
    </book>
	
	
	
	<book>
        <author_info>
            <author_name>
                <Firstname>Nilesh</Firstname>
                <Lastname>Pandey</Lastname>
            </author_name>
            <date_of_birth>1985-03-28</date_of_birth>
            <highedu>MS</highedu>
            <address>
                <StreetnameAuthor>65 Jamaica st</StreetnameAuthor>
                <Aptnum>13</Aptnum>
                <CityAuthor>Sydney</CityAuthor>
                <zipcodeAuthor>12457</zipcodeAuthor>
                <CountryAuthor>USA</CountryAuthor>
            </address>
            <Pbookno>4</Pbookno>
        </author_info>
        <bookinfo>
            <Title>Trending Tyres</Title>
            <ISBN>902-283-5363</ISBN>
            <price currency="dollars">111.00</price>
            <Pub_date>2007-11-09</Pub_date>
            <Pub_info>
                <pub_name>Pocketnow Solutions</pub_name>
                <pub_address>
                    <Streetname>A7a Royal ave</Streetname>
                    <suite_no>05</suite_no>
                    <City>Delhi</City>
                    <zipcode>60021</zipcode>
                    <Country>India</Country>
                </pub_address>
                <C_time>07-02-21</C_time>
            </Pub_info>
        </bookinfo>
    </book>
	
	
</bookdata>
